no_isic_secao;no_cuci_pos;vl_fob;participacao
Outros Produtos;Desperdícios, resíduos e aparas de plásticos;1214052;0,0078
Outros Produtos;Outros produtos residuais das indústrias químicas, resíduos urbanos, lodo de esgoto e outros resíduos;8023;0,0001
Outros Produtos;Embarcações e outras estruturas flutantes para desmantelar;777;0,000004991
Outros Produtos;Outros suprimentos fotográficos;1;6,4235e-9
Outros Produtos;Material impresso;1408118;0,009
Outros Produtos;Obras de arte, peças de coleção e antiguidades;582027;0,0037
