no_isic_secao;no_cuci_pos;vl_fob;participacao
Agropecuária;Animais vivos, não incluído pescados ou crustáceos;27725836;0,1781
Agropecuária;Pescado inteiro vivo, morto ou refrigerado;139632;0,0009
Agropecuária;Crustáceos não congelados comestíveis;2870;0
Agropecuária;Trigo e centeio, não moídos;12;7,7082e-8
Agropecuária;Cevada, não moída;0;0
Agropecuária;Milho não moído, exceto milho doce;450326064;2,8927
Agropecuária;Centeio, aveia e outros cereais, não moídos;884960;0,0057
Agropecuária;Produtos hortícolas, frescos ou refrigerados;40583726;0,2607
Agropecuária;Frutas e nozes não oleaginosas, frescas ou secas;13289296;0,0854
Agropecuária;Mel natural;15724185;0,101
Agropecuária;Café não torrado;37017324;0,2378
Agropecuária;Mate, extrato, essência e concentrado;7084621;0,0455
Agropecuária;Especiarias;987174;0,0063
Agropecuária;Soja;3310828577;21,2671
Agropecuária;Sementes oleaginosas de girassol, gergelim, canola, algodão e outras;732155;0,0047
Agropecuária;Outras sementes oleaginosas de copra ou linhaça;774;0,0000049718
Agropecuária;Látex, borracha natural, balata, guta-percha, guaiúle, chicle e gomas naturais;9386;0,0001
Agropecuária;Lenha e carvão vegetal;46097;0,0003
Agropecuária;Madeira em bruto;50374;0,0003
Agropecuária;Algodão em bruto;117966;0,0008
Agropecuária;Juta e outras fibras têxteis liberianas em bruto;417;0,0000026786
Agropecuária;Matérias vegetais em bruto;4992495;0,0321
Indústria Extrativa;Fertilizantes brutos (exceto adubos);331416;0,0021
Indústria Extrativa;Pedra, areia e cascalho;1040328;0,0067
Indústria Extrativa;Outros minerais em bruto;7140261;0,0459
Indústria Extrativa;Minérios de metais preciosos e seus concentrados;6020860;0,0387
Indústria de Transformação;Carne bovina fresca, refrigerada ou congelada;124773038;0,8015
Indústria de Transformação;Carnes de aves e suas miudezas comestíveis, frescas, refrigeradas ou congeladas;2316136600;14,8777
Indústria de Transformação;Carne suína fresca, refrigerada ou congelada;364702208;2,3427
Indústria de Transformação;Outras carnes e miudezas comestíveis, frescas, refrigeradas ou congeladas;15335598;0,0985
Indústria de Transformação;Outras carnes comestíveis salgadas, em salmoras, secas ou defumadas;43828327;0,2815
Indústria de Transformação;Despojos comestíveis de carnes, preparados ou preservados;159602112;1,0252
Indústria de Transformação;Leite, creme de leite e laticínios, exceto manteiga ou queijo;5452332;0,035
Indústria de Transformação;Manteiga e outras gorduras e óleos derivados do leite;7913344;0,0508
Indústria de Transformação;Queijo e coalhada;1152188;0,0074
Indústria de Transformação;Ovos de aves, gemas de ovos, frescos, desidratados ou preservados, adoçados ou não, e derivados;22033000;0,1415
Indústria de Transformação;Filés ou outras carnes de peixes congelados, frescos ou refrigerados;22229156;0,1428
Indústria de Transformação;Pescado, seco, salgado, em salmoura, defumado, ou preparados comestíveis;1765;0
Indústria de Transformação;Crustáceos, moluscos e invertebrados aquáticos congelados, refrigerados ou frescos, secos, salgados, em salmoura ou preparados comestíveis;39281;0,0003
Indústria de Transformação;Outros pescado, crustáceos, moluscos, preparados ou preservados;33266;0,0002
Indústria de Transformação;Arroz sem casca ou semi elaborado, polido, glaceado, quebrado, parbolizado ou convertido;103552;0,0007
Indústria de Transformação;Ração ou farinha de trigo e centeio;219399;0,0014
Indústria de Transformação;Ração ou farinha de outros cereais;11113140;0,0714
Indústria de Transformação;Preparações e cereais, de farinhas, ou amido de frutas ou vegetais;14652935;0,0941
Indústria de Transformação;Produtos hortícolas cozidos, congelados ou conservados transitoriamente;271620;0,0017
Indústria de Transformação;Legumes, raízes e tubérculos, preparados ou conservados;6237747;0,0401
Indústria de Transformação;Frutas, preservados e preparações (exceto sucos de frutas);4941109;0,0317
Indústria de Transformação;Sucos de frutas ou de vegetais;48357763;0,3106
Indústria de Transformação;Açúcares e melaços;803580214;5,1618
Indústria de Transformação;Artigos de confeitaria;12513387;0,0804
Indústria de Transformação;Café torrado, extratos, essências e concentrados de café;281259635;1,8067
Indústria de Transformação;Cacau em pó, manteiga ou pasta de cacau;6547;0
Indústria de Transformação;Chocolate e outras preparações alimentícias contendo cacau;16407122;0,1054
Indústria de Transformação;Chá, mesmo aromatizado;7495;0
Indústria de Transformação;Farelos de soja e outros alimentos para animais (excluídos cereais não moídos), farinhas de carnes e outros animais;909792543;5,844
Indústria de Transformação;Margarina e reduções;9417547;0,0605
Indústria de Transformação;Outros produtos comestíveis e preparações;61905673;0,3977
Indústria de Transformação;Outras bebidas não-alcoólicas;399523;0,0026
Indústria de Transformação;Bebidas alcoólicas;6413320;0,0412
Indústria de Transformação;Charutos, cigarros e outros produtos de tabaco;442853;0,0028
Indústria de Transformação;Couros e peles em bruto;1593709;0,0102
Indústria de Transformação;Amendoins;308277;0,002
Indústria de Transformação;Outras farinhas e pós de sementes oleaginosas;1136;0,0000072971
Indústria de Transformação;Borrachas sintéticas;26585;0,0002
Indústria de Transformação;Madeira em estilhas ou partículas;169;0,0000010856
Indústria de Transformação;Madeira, parcialmente trabalhada e dormentes de madeira;246792765;1,5853
Indústria de Transformação;Celulose;380357697;2,4432
Indústria de Transformação;Fibras têxteis vegetais (exceto algodão e juta) em bruto ou trabalhadas, não fiadas e resíduos destas fibras;8129;0,0001
Indústria de Transformação;Fibras sintéticas adequadas para a fiação;47276;0,0003
Indústria de Transformação;Lã e pelos cardados ou penteados e outras lãs;27732;0,0002
Indústria de Transformação;Nitrato de sódio;77436;0,0005
Indústria de Transformação;Enxofre;117866;0,0008
Indústria de Transformação;Outros abrasivos naturais;9646;0,0001
Indústria de Transformação;Alumina (óxido de alumínio), exceto corindo artificial;3152;0
Indústria de Transformação;Matérias brutas de animais;30268429;0,1944
Indústria de Transformação;Outras matérias de origem vegetal;5720140;0,0367
Indústria de Transformação;Óleos combustíveis de petróleo ou de minerais betuminosos (exceto óleos brutos);356816962;2,292
Indústria de Transformação;Produtos residuais de petróleo e materiais relacionados;106198753;0,6822
Indústria de Transformação;Propano e butano liquefeito;8621;0,0001
Indústria de Transformação;Gás de petróleo e outros hidrocarbonetos gasosos;3525;0
Indústria de Transformação;Óleos e gorduras animais;37058750;0,238
Indústria de Transformação;Gorduras e óleos vegetais, "soft", bruto, refinado ou fracionado;398169233;2,5576
Indústria de Transformação;Gorduras e óleos vegetais, em bruto, refinados ou fracionados (excluídos "soft");1210237;0,0078
Indústria de Transformação;Outras gorduras e óleos animais ou vegetais, processados, ceras, misturas ou preparações não alimentícias;9607859;0,0617
Indústria de Transformação;Outros hidrocarbonetos e seus derivados halogenados, sulfonados, nitrados ou nitrosados;2151199;0,0138
Indústria de Transformação;Álcoois, fenóis, fenóis-álcoois, e seus derivados halogenados, sulfonados, nitrados ou nitrosados;50667672;0,3255
Indústria de Transformação;Ácidos carboxílicos e seus anidridos, halogenetos, peróxidos e perácidos e seus derivados;43734682;0,2809
Indústria de Transformação;Compostos de função nitrogênio;12060138;0,0775
Indústria de Transformação;Compostos organo-inorgânicos, compostos heterocíclicos, ácidos nucléicos e seus sais, e sulfonamidas;1786482;0,0115
Indústria de Transformação;Outros produtos químicos orgânicos;31230623;0,2006
Indústria de Transformação;Elementos químicos inorgânicos, óxidos e sais de halogêneos;555158;0,0036
Indústria de Transformação;Sais e peroxossais, de ácidos inorgânicos e metais;866116;0,0056
Indústria de Transformação;Outros produtos químicos inorgânicos. compostos orgânicos e inorgânicos de metais preciosos;41857169;0,2689
Indústria de Transformação;Matérias corantes sintéticas e lacas corantes e suas preparações ;1361909;0,0087
Indústria de Transformação;Extratos para tingimento e curtimento e materiais sintéticos de bronzeamento;849314;0,0055
Indústria de Transformação;Pigmentos, tintas, vernizes e materiais relacionados;17734412;0,1139
Indústria de Transformação;Medicamentos e produtos farmacêuticos, exceto veterinários;35954111;0,231
Indústria de Transformação;Outros medicamentos, incluindo veterinários;1497470;0,0096
Indústria de Transformação;Óleos essenciais, matérias de perfume e sabor ;15852844;0,1018
Indústria de Transformação;Produtos de perfumaria ou de toucador, exceto sabonetes;30164833;0,1938
Indústria de Transformação;Sabão, preparações de limpeza e de polimento;5299757;0,034
Indústria de Transformação;Adubos ou fertilizantes químicos (exceto fertilizantes brutos);87602484;0,5627
Indústria de Transformação;Polímeros de etileno, em formas primárias;210478;0,0014
Indústria de Transformação;Polímeros de estireno, em formas primárias;692147;0,0044
Indústria de Transformação;Polímeros de cloreto de vinila ou de outras olefinas halogenadas, em formas primárias;144204;0,0009
Indústria de Transformação;Poliacetais, outros poliéteres e resinas epóxidas. policarbonatos, resinas alquídicas e outros poliésteres. em formas primárias;8677336;0,0557
Indústria de Transformação;Outras matérias plásticas em formas primárias;36133081;0,2321
Indústria de Transformação;Tubos, canos e mangueiras, e seus acessórios, de matérias plásticas;4079242;0,0262
Indústria de Transformação;Chapas, folhas, películas, tiras e lâminas, de plásticos;24655655;0,1584
Indústria de Transformação;Monofilamentos (corte superior a 1 mm), varas, bastões e perfis, mesmo trabalhados à superfície, mas sem qualquer outro trabalho, de plásticos;3066871;0,0197
Indústria de Transformação;Inseticidas, rodenticidas, fungicidas, herbicidas, reguladores de crescimento para plantas, desinfetantes e semelhantes;11235567;0,0722
Indústria de Transformação;Amidos, inulina e glúten de trigo, matérias albuminóides, colas;70844232;0,4551
Indústria de Transformação;Explosivos e produtos pirotécnicos;13060224;0,0839
Indústria de Transformação;Preparações lubrificantes, aditivos para óleos minerais e similares, líquidos de transmissões hidráulicas, preparações anticongelantes;1421604;0,0091
Indústria de Transformação;Outros produtos diversos das indústrias químicas;90335051;0,5803
Indústria de Transformação;Couro;103559375;0,6652
Indústria de Transformação;Selas e arreios;175119;0,0011
Indústria de Transformação;Materiais de borracha (pastas, chapas, folhas, hastes, fios, tubos de borracha e outros);1774717;0,0114
Indústria de Transformação;Pneus de borracha, bandas de rodagem intercambiáveis, flaps e câmaras de ar para rodas ;28322251;0,1819
Indústria de Transformação;Outros artigos de borracha;7628151;0,049
Indústria de Transformação;Manufaturas de cortiça ;13654;0,0001
Indústria de Transformação;Folheados, contraplacados, aglomerados, e outras madeiras, trabalhados;470104828;3,0197
Indústria de Transformação;Manufaturas de madeira;71246659;0,4577
Indústria de Transformação;Papel e cartão;497763446;3,1974
Indústria de Transformação;Papel e cartão, cortados em forma, e artigos de papel ou cartão;43275684;0,278
Indústria de Transformação;Fios têxteis;9219893;0,0592
Indústria de Transformação;Tecidos de algodão, telas (não incluindo as fitas ou especiais);6939820;0,0446
Indústria de Transformação;Tecidos, tramas, de matérias têxteis sintéticas ou artificiais (não incluídas as fitas ou especiais);2008365;0,0129
Indústria de Transformação;Outras obras têxteis;22131;0,0001
Indústria de Transformação;Tecidos de malha (incluindo tecidos tubulares de malha, veludos e tecidos abertos);1079435;0,0069
Indústria de Transformação;Tules, rendas, bordados, fitas, guarnições e armarinhos;529509;0,0034
Indústria de Transformação;Fios especiais, tecidos especiais e produtos relacionados;5302418;0,0341
Indústria de Transformação;Artigos confeccionados, total ou principalmente de matérias têxteis;1287737;0,0083
Indústria de Transformação;Revestimentos de piso;1064248;0,0068
Indústria de Transformação;Cal, cimento e materiais de construção fabricada (exceto materiais de vidro e barro);8955313;0,0575
Indústria de Transformação;Materiais de construção de argila e materiais de construção refratários;21767425;0,1398
Indústria de Transformação;Outros artigos de materiais minerais;5871889;0,0377
Indústria de Transformação;Vidro;2925244;0,0188
Indústria de Transformação;Vidraria;70811;0,0005
Indústria de Transformação;Olaria;1117172;0,0072
Indústria de Transformação;Pérolas e pedras preciosas ou semipreciosas, em bruto ou trabalhadas;41405;0,0003
Indústria de Transformação;Ferro-gusa, spiegel, ferro-esponja, grânulos e pó de ferro ou aço e ferro-ligas;91691;0,0006
Indústria de Transformação;Produtos semi-acabados, lingotes e outras formas primárias de ferro ou aço;34354;0,0002
Indústria de Transformação;Produtos laminados planos de ferro ou aço não ligado, não folheados ou chapeados, ou revestidos;576355;0,0037
Indústria de Transformação;Produtos laminados planos de ferro ou aço não ligado, folheados ou chapeados, ou revestidos;3489233;0,0224
Indústria de Transformação;Produtos laminados planos, de ligas de aço;1232314;0,0079
Indústria de Transformação;Barras de ferro e aço, barras, cantoneiras e perfis (incluindo estacas-prancha);471065;0,003
Indústria de Transformação;Trilhos ou elementos de vias férreas, de ferro ou aço;1881640;0,0121
Indústria de Transformação;Fios de ferro ou aço;81000;0,0005
Indústria de Transformação;Tubos e perfis ocos, e acessórios para tubos, de ferro ou aço;800372;0,0051
Indústria de Transformação;Prata, platina e outros metais do grupo da platina;280181;0,0018
Indústria de Transformação;Cobre;441399;0,0028
Indústria de Transformação;Níquel;370;0,0000023767
Indústria de Transformação;Alumínio;14341960;0,0921
Indústria de Transformação;Chumbo;512;0,0000032888
Indústria de Transformação;Zinco;10710;0,0001
Indústria de Transformação;Estanho;52121;0,0003
Indústria de Transformação;Metais não-ferrosos diversos empregados na metalurgia e cermets;24790;0,0002
Indústria de Transformação;Estruturas e partes de estruturas, de ferro, aço ou alumínio;4594730;0,0295
Indústria de Transformação;Recipientes de metal para armazenamento ou transporte;1470184;0,0094
Indústria de Transformação;Produtos de fiação (excluindo fiação elétrica isolados) e grelhas de esgrima;634212;0,0041
Indústria de Transformação;Pregos, parafusos, porcas, parafusos, rebites e semelhantes, de ferro, aço, cobre ou alumínio;2953796;0,019
Indústria de Transformação;Ferramentas para uso manual ou em máquinas;19290022;0,1239
Indústria de Transformação;Talheres;148663;0,001
Indústria de Transformação;Equipamentos domésticos de metais comuns;16626794;0,1068
Indústria de Transformação;Obras de ferro ou aço e outros artigos de metais comuns;16700477;0,1073
Indústria de Transformação;Caldeiras de geradores de vapor, caldeiras de água sobreaquecida, aparelhos auxiliares e suas partes;2122983;0,0136
Indústria de Transformação;Turbinas a vapor e outras turbinas a vapor e suas partes;600000;0,0039
Indústria de Transformação;Motores de pistão, e suas partes;123322657;0,7922
Indústria de Transformação;Motores e máquinas não elétricos, e suas partes (exceto motores de pistão e geradores) ;127121;0,0008
Indústria de Transformação;Geradores elétricos giratórios e suas partes;7978412;0,0512
Indústria de Transformação;Máquinas de geração de energia e suas partes;953922;0,0061
Indústria de Transformação;Máquinas agrícolas (com exceção dos tractores) e suas partes;44503593;0,2859
Indústria de Transformação;Tratores;53664824;0,3447
Indústria de Transformação;Instalações e equipamentos de engenharia civil e contrutores, e suas partes;312510934;2,0074
Indústria de Transformação;Máquinas têxteis e para couro e suas partes;5173954;0,0332
Indústria de Transformação;Maquinaria de papel e celulose, máquinas de corte de papel e fabricação de artigos de papel, e suas partes;5773609;0,0371
Indústria de Transformação;Máquinas de impressão e encadernação e suas partes;5979029;0,0384
Indústria de Transformação;Máquinas de processamento de alimentos (excluindo domésticas), e suas partes;5213931;0,0335
Indústria de Transformação;Outras máquinas e equipamentos especializados para determinadas indústrias e suas partes;31157334;0,2001
Indústria de Transformação;Maquinas que trabalham por eliminação de metal ou outro material;2382477;0,0153
Indústria de Transformação;Máquinas-ferramentas para trabalhar metais, carbonetos metálicos sinterizados ou ceramais, sem eliminação de matéria;586197;0,0038
Indústria de Transformação;Peças e acessórios destinados a máquinas e porta-ferramentas;397384;0,0026
Indústria de Transformação;Máquinas para metalurgia (exceto máquinas-ferramentas) e suas partes;508530;0,0033
Indústria de Transformação;Aquecimento e resfriamento de equipamentos e suas partes;28691923;0,1843
Indústria de Transformação;Bombas para líquidos, elevadores de líquidos e suas partes;16067632;0,1032
Indústria de Transformação;Bombas, centrífugas, compressores de ar, ventiladores, exaustores, aparelhos de filtrar ou depurar e suas partes;32344567;0,2078
Indústria de Transformação;Equipamento mecânico para manuseio, elevação, guinchos e suas partes;11033432;0,0709
Indústria de Transformação;Máquinas não elétricas, ferramentas e aparelhos mecânicos, e suas partes, n.e.p.;11937456;0,0767
Indústria de Transformação;Rolamentos de esferas ou de roletes ;2519140;0,0162
Indústria de Transformação;Torneiras, válvulas e dispositivos semelhantes para canalizações, caldeiras, reservatórios, cubas e outros recipientes;84525154;0,5429
Indústria de Transformação;Veios de transmissão e manivelas, engrenagens, rodas de fricção, volantes, polias, embreagens, elos articulados e suas partes;8876614;0,057
Indústria de Transformação;Partes não elétricas e acessórios de máquinas;5003964;0,0321
Indústria de Transformação;Máquinas para escritórios;501716;0,0032
Indústria de Transformação;Máquinas de processamento automático de dados e suas unidades, para registrar dados, leitores magnéticos ou óticos;835466;0,0054
Indústria de Transformação;Peças e acessórios (exceto estojos, capas e semelhantes) para a máquinas de processamento de dados ou máquinas de escritórios;51795;0,0003
Indústria de Transformação;Monitores e projetores, aparelhos receptores de televisão, aparelhos de som para gravação ou reprodução;13637;0,0001
Indústria de Transformação;Aparelhos receptores de radiodifusão, mesmo combinados com aparelhos de reprodução ou gravação de som ou um relógio;371320;0,0024
Indústria de Transformação;Aparelhos de gravação de som ou de reprodução, gravação de vídeo ou de reprodução, mesmo incorporando um receptor de sinais de vídeo;551;0,0000035393
Indústria de Transformação;Equipamentos de telecomunicações, incluindo peças e acessórios;8777473;0,0564
Indústria de Transformação;Máquinas de energia elétrica (exceto planta elétrica rotativa do grupo 716) e suas partes;34012551;0,2185
Indústria de Transformação;Aparelhos elétricos para ligação, proteção ou conexão de circuitos;12985720;0,0834
Indústria de Transformação;Equipamento para distribuição de energia elétrica;61578202;0,3955
Indústria de Transformação;Aparelho eletrodiagnósticos para usos medicinais, cirúrgicos, dentários ou veterinários, e aparelho radiológico;1799058;0,0116
Indústria de Transformação;Equipamentos elétricos e não elétricos de uso doméstico;27422764;0,1761
Indústria de Transformação;Válvulas e tubos termiônicas, de cátodo frio ou foto-cátodo, diodos, transistores;2415382;0,0155
Indústria de Transformação;Máquinas e aparelhos elétricos;65714978;0,4221
Indústria de Transformação;Veículos automóveis de passageiros;537483455;3,4525
Indústria de Transformação;Veículos automóveis para transporte de mercadorias e usos especiais;312444553;2,007
Indústria de Transformação;Veículos rodoviários;248098981;1,5937
Indústria de Transformação;Partes e acessórios dos veículos automotivos;201623376;1,2951
Indústria de Transformação;Motocicletas, bicicletas motorizadas ou não e veículos para inválidos;3037273;0,0195
Indústria de Transformação;Reboques e semi-reboques. outros veículos de propulsão não-mecânica. contentores de transporte especialmente concebidos e equipados;6359567;0,0409
Indústria de Transformação;Veículos ferroviários e equipamentos associados;142576;0,0009
Indústria de Transformação;Aeronaves e outros equipamentos, incluindo suas partes;1278016;0,0082
Indústria de Transformação;Plataformas, embarcações e outras estruturas flutuantes;3217760;0,0207
Indústria de Transformação;Construções pré-fabricadas;107117;0,0007
Indústria de Transformação;Equipamentos e acessórios sanitários, de canalização e aquecimento;68289;0,0004
Indústria de Transformação;Luminárias e acessórios;1284070;0,0082
Indústria de Transformação;Móveis e suas partes. roupas de cama, colchões, suportes de colchão, almofadas e semelhantes;111197556;0,7143
Indústria de Transformação;Malas, pastas, estojos e sacos de viagem. bolsas e artefatos semelhantes;563870;0,0036
Indústria de Transformação;Casacos masculinos ou infantis, capas, jaquetas, ternos, blazers, calças, shorts, camisas, roupas íntimas, roupa de dormir e artigos semelhantes de tecidos, exceto de malha (exceto os do subgrupo 845.2);426930;0,0027
Indústria de Transformação;Casacos femininos e infantis, capas, jaquetas, ternos, calças, shorts, camisas, vestidos e saias, roupa interior, roupa de dormir e artigos semelhantes de tecidos, de malha (exceto os do subgrupo 845.2);442712;0,0028
Indústria de Transformação;Casacos masculinos e infantis, capas, jaquetas, ternos, blazers, calças, shorts, camisas, roupa interior, vestuário e artigos semelhantes de tecidos, de malha;722096;0,0046
e Transformação;Casacos femininos e infantis, capas, jaquetas, ternos, calças, shorts, camisas, vestidos e saias, roupa interior, de dormir e artigos semelhantes de tecidos, de malha;1037707;0,0067
e Transformação;Vestuário, de tecidos têxteis, mesmo de malha;2399553;0,0154
e Transformação;Acessórios, de tecidos têxteis, mesmo de malha (exceto para bebês);145811;0,0009
e Transformação;Artigos de vestuário e seus acessórios de outros tecidos, ou chapelaria de todos os materiais;4907237;0,0315
e Transformação;Calçados;6682721;0,0429
e Transformação;Instrumentos óticos e aparelhos;38122;0,0002
e Transformação;Instrumentos e aparelhos para usos medicinais, cirúrgicos, dentários ou veterinários;24147292;0,1551
e Transformação;Metros e contadores;2921412;0,0188
e Transformação;Instrumentos e aparelhos de medição, verificação, análise e controle;14702828;0,0944
e Transformação;Aparelhos fotográficos e equipamentos;31517;0,0002
e Transformação;Suprimentos fotográficos e cinematográficos;190262;0,0012
e Transformação;Lentes e itens óticos;1213248;0,0078
e Transformação;Relógios;38786;0,0002
e Transformação;Armas e munições;15193263;0,0976
e Transformação;Outros artigos de plásticos;23243317;0,1493
e Transformação;Carrinhos de bebê, brinquedos, jogos e artigos esportivos;1077539;0,0069
e Transformação;Suprimentos de escritório e papelaria;1029680;0,0066
e Transformação;Jóias, ourivesaria, seus artigos e outros artigos de matérias preciosas ou semipreciosas;424108;0,0027
e Transformação;Instrumentos musicais e suas partes e acessórios, discos, fitas e outros suportes de som ou semelhantes;26446031;0,1699
e Transformação;Outros artigos manufaturados diversos,;50990672;0,3275
e Transformação;Ouro, não monetário (excluindo minérios de ouro e seus concentrados);13687438;0,0879
rodutos;Resíduos vegetais, feno, forragens e outros farelos;2740900;0,0176
rodutos;Desperdícios de tabaco;5520;0
rodutos;Resíduos de couro ou couro usado;2224;0
rodutos;Desperdícios e resíduo de borrachas;11014;0,0001
rodutos;Resíduos e serragens de madeira ou sucatas;16175098;0,1039
rodutos;Desperdícios e resíduos de papel;770277;0,0049
rodutos;Desperdícios de seda ou casulos de bicho da seda;39600;0,0003
Outros Produtos;Desperdícios de algodão;79257;0,0005
Outros Produtos;Roupas e outros artigos têxteis usados, incluindo trapos;2520;0
Outros Produtos;Resíduos e sucata de metais ferrosos;20477534;0,1315
Outros Produtos;Resíduos de metais de base não ferrosos e de sucata;12597467;0,0809
Outros Produtos;Desperdícios e resíduos de metais preciosos (exceto ouro);14974818;0,0962
Outros Produtos;Ossos, chifres, marfim, cascos, garras, coral, conchas e outros semelhantes;1746597;0,0112
Outros Produtos;Refugos de petróleo;726;0,0000046635
Outros Produtos;Gás de carvão, gás de água, gás de produção e semelhantes, exceto gases de petróleo e outros hidrocarbonetos gasosos;119;7,6439e-7
Outros Produtos;Energia elétrica;60686969;0,3898
